Ticker,Name,Exchange,Category Name,Country
PHOL-R.BK,Phol Dhanya Public Company Limited,SET,N/A,Thailand
PACE.BK,Pace Development Corporation Public Company Limited,SET,N/A,Thailand
TAE.BK,Thai Agro Energy Public Company Limited,SET,N/A,Thailand
WHAPF.BK,WHA Premium Factory and Warehouse Freehold and Leasehold Property Fund,SET,N/A,Thailand
TPCH.BK,TPC Power Holding Public Company Limited,SET,N/A,Thailand
JUBILE.BK,Jubilee Enterprise Public Company Limited,SET,N/A,Thailand
JTS.BK,Jasmine Telecom Systems Public Company Limited,SET,N/A,Thailand
JMT-R.BK,JMT Network Services Public Company Limited,SET,N/A,Thailand
JASIF.BK,Jasmine Broadband Internet Infrastructure Fund,SET,N/A,Thailand
JCT.BK,Jack Chia Industries (Thailand) Public Company Limited,SET,N/A,Thailand
JWD.BK,JWD Infologistics Public Company Limited,SET,N/A,Thailand
JMART.BK,Jay Mart Public Company Limited,SET,N/A,Thailand
NPK-R.BK,New Plus Knitting Public Company Limited,SET,N/A,Thailand
KTC.BK,Krungthai Card Public Company Limited,SET,N/A,Thailand
KTC-R.BK,Krungthai Card Public Company Limited,SET,N/A,Thailand
KTB.BK,Krung Thai Bank Public Company Limited,SET,N/A,Thailand
KGI.BK,KGI Securities (Thailand) Public Company Limited,SET,N/A,Thailand
KC.BK,K.C. Property Public Company Limited,SET,N/A,Thailand
KASET.BK,Thai HA Public Company Limited,SET,N/A,Thailand
KPNPF.BK,KPN Property Fund,SET,N/A,Thailand
KWC-R.BK,Krungdhep Sophon Public Company Limited,SET,N/A,Thailand
POMPUI.BK,KUANG PEI SAN FOOD PRODUCTS,SET,N/A,Thailand
NEP-R.BK,NEP Realty and Industry Public Company Limited,SET,N/A,Thailand
UPA-R.BK,United Power of Asia Public Company Limited,SET,N/A,Thailand
QHPF.BK,Quality Houses Leasehold Property Fund,SET,N/A,Thailand
QLT-R.BK,Qualitech Public Company Limited,SET,N/A,Thailand
QH.BK,Quality Houses Public Company Limited,SET,N/A,Thailand
QTC-R.BK,QTC Energy Public Company Limited,SET,N/A,Thailand
Q-CON-R.BK,Quality Construction Products Public Company Limited,SET,N/A,Thailand
QHOP.BK,Quality Hospitality Leasehold Property Fund,SET,N/A,Thailand
QLT.BK,Qualitech Public Company Limited,SET,N/A,Thailand
QHHR.BK,Quality Houses Hotel and Residence Freehold and Leasehold Property Fund,SET,N/A,Thailand
QH-R.BK,Quality Houses Public Company Limited,SET,N/A,Thailand
QTC.BK,QTC Energy Public Company Limited,SET,N/A,Thailand
Q-CON.BK,Quality Construction Products Public Company Limited,SET,N/A,Thailand
SPRC-R.BK,Star Petroleum Refining Public Company Limited,SET,N/A,Thailand
SVH.BK,Samitivej Public Company Limited,SET,N/A,Thailand
UWC-R.BK,Ua Withya Public Company Limited,SET,N/A,Thailand
UPF-R.BK,Union Pioneer Public Company Limited,SET,N/A,Thailand
UNIQ.BK,Unique Engineering And Construction Public Company Limited,SET,N/A,Thailand
VIBHA.BK,Vibhavadi Medical Center Public Company Limited,SET,N/A,Thailand
VARO.BK,Varopakorn Public Company Limited,SET,N/A,Thailand
VIH.BK,Srivichaivejvivat Public Company Limited,SET,N/A,Thailand
WIN-R.BK,Wyncoast Industrial Park Public Company Limited,SET,N/A,Thailand
TWPC-R.BK,Thai Wah Public Company Limited,SET,N/A,Thailand
WR.BK,WE RETAIL PUBLIC COMPANY LIMITE,SET,N/A,Thailand
WHA.BK,WHA Corporation Public Company Limited,SET,N/A,Thailand
WHABT.BK,WHA Business Complex Freehold and Leasehold Real Estate Investment Trust,SET,N/A,Thailand
TWS.BK,Thai Wah Starch Public Company Limited,SET,N/A,Thailand
WG.BK,White Group Public Company Limited,SET,N/A,Thailand
WORLD-R.BK,WORLD CORPORATION PUBLIC COMPAN,SET,N/A,Thailand
WHART.BK,WHA Premium Growth Freehold And Leasehold Real Estate Investment Trust,SET,N/A,Thailand
WIIK.BK,Wiik & Hoeglund Public Company Limited,SET,N/A,Thailand
SPA-R.BK,Siam Wellness Group Public Company Limited,SET,N/A,Thailand
XO-R.BK,Exotic Food Public Company Limited,SET,N/A,Thailand
XO.BK,Exotic Food Public Company Limited,SET,N/A,Thailand
YUASA.BK,Yuasa Battery (Thailand) Public Company Limited,SET,N/A,Thailand
YCI.BK,YONG THAI PUBLIC COMPANY LIMITE,SET,N/A,Thailand
YUASA-R.BK,Yuasa Battery (Thailand) Public Company Limited,SET,N/A,Thailand
YNP-R.BK,YARNAPUND PUBLIC COMPANY LIMITE,SET,N/A,Thailand
YCI-R.BK,YONG THAI PUBLIC COMPANY LIMITE,SET,N/A,Thailand
YNP.BK,YARNAPUND PUBLIC COMPANY LIMITE,SET,N/A,Thailand
ZMICO-R.BK,Seamico Securities Public Company Limited,SET,N/A,Thailand
ZMICO.BK,Seamico Securities Public Company Limited,SET,N/A,Thailand
AAV.BK,Asia Aviation Public Company Limited,SET,N/A,Thailand
AAV-R.BK,Asia Aviation Public Company Limited,SET,N/A,Thailand
ABPIF.BK,Amata B. Grimm Power Plant Infrastructure Fund,SET,N/A,Thailand
ABICO-R.BK,Abico Holdings Public Company Limited,SET,N/A,Thailand
ABICO.BK,Abico Holdings Public Company Limited,SET,N/A,Thailand
EA-R.BK,Energy Absolute Public Company Limited,SET,N/A,Thailand
ABC-R.BK,Asset Bright Public Company Limited,SET,N/A,Thailand
EA.BK,Energy Absolute Public Company Limited,SET,N/A,Thailand
ABC.BK,Digital Tech Planet Public Company Limited,SET,N/A,Thailand
ACD-R.BK,Green Resources Public Company Limited,SET,N/A,Thailand
ACAP-R.BK,Asia Capital Group Public Company Limited,SET,N/A,Thailand
ACC-R.BK,Advanced Connection Corporation Public Company Limited,SET,N/A,Thailand
ACC.BK,Advanced Connection Corporation Public Company Limited,SET,N/A,Thailand
ACAP.BK,Asia Capital Group Public Company Limited,SET,N/A,Thailand
AJD.BK,AJ Advance Technology Public Company Limited,SET,N/A,Thailand
ADAM-R.BK,ADAMAS INCORPORATION PUBLIC COM,SET,N/A,Thailand
ADVANC.BK,Advanced Info Service Public Company Limited,SET,N/A,Thailand
ADVANC-R.BK,Advanced Info Service Public Company Limited,SET,N/A,Thailand
ADVA42P1602A.BK,ADVA42P1602A.BK,SET,N/A,Thailand
AEONTS-R.BK,AEON Thana Sinsap (Thailand) Public Company Limited,SET,N/A,Thailand
AEC-R.BK,AEC Securities Public Company Limited,SET,N/A,Thailand
AEONTS.BK,AEON Thana Sinsap (Thailand) Public Company Limited,SET,N/A,Thailand
AEC.BK,AEC Securities Public Company Limited,SET,N/A,Thailand
AFC.BK,Asia Fiber Public Company Limited,SET,N/A,Thailand
AF.BK,Aira Factoring Public Company Limited,SET,N/A,Thailand
AF-R.BK,Aira Factoring Public Company Limited,SET,N/A,Thailand
AFC-R.BK,Asia Fiber Public Company Limited,SET,N/A,Thailand
TAE-R.BK,Thai Agro Energy Public Company Limited,SET,N/A,Thailand
AGE.BK,Asia Green Energy Public Company Limited,SET,N/A,Thailand
AGE-R.BK,Asia Green Energy Public Company Limited,SET,N/A,Thailand
AHC.BK,Aikchol Hospital Public Company Limited,SET,N/A,Thailand
AH-R.BK,AAPICO Hitech Public Company Limited,SET,N/A,Thailand
AH.BK,AAPICO Hitech Public Company Limited,SET,N/A,Thailand
AHC-R.BK,Aikchol Hospital Public Company Limited,SET,N/A,Thailand
EFORL.BK,E for L Aim Public Company Limited,SET,N/A,Thailand
AIRA-R.BK,AIRA Capital Public Company Limited,SET,N/A,Thailand
AIT-R.BK,Advanced Information Technology Public Company Limited,SET,N/A,Thailand
AIRA.BK,AIRA Capital Public Company Limited,SET,N/A,Thailand
NOK-R.BK,Nok Airlines Public Company Limited,SET,N/A,Thailand
AIE-R.BK,AI Energy Public Company Limited,SET,N/A,Thailand
BA-R.BK,Bangkok Airways Public Company Limited,SET,N/A,Thailand
EFORL-R.BK,E for L Aim Public Company Limited,SET,N/A,Thailand
AIE.BK,AI Energy Public Company Limited,SET,N/A,Thailand
BA.BK,Bangkok Airways Public Company Limited,SET,N/A,Thailand
AI-R.BK,Asian Insulators Public Company Limited,SET,N/A,Thailand
NOK.BK,Nok Airlines Public Company Limited,SET,N/A,Thailand
AI.BK,Asian Insulators Public Company Limited,SET,N/A,Thailand
AIT.BK,Advanced Information Technology Public Company Limited,SET,N/A,Thailand
AJD-R.BK,AJ Advance Technology Public Company Limited,SET,N/A,Thailand
AJ-R.BK,A.J. Plast Public Company Limited,SET,N/A,Thailand
AJ.BK,A.J. Plast Public Company Limited,SET,N/A,Thailand
AKR-R.BK,Ekarat Engineering Public Company Limited,SET,N/A,Thailand
AKP.BK,Akkhie Prakarn Public Company Limited,SET,N/A,Thailand
AKP-R.BK,Akkhie Prakarn Public Company Limited,SET,N/A,Thailand
AKR.BK,Ekarat Engineering Public Company Limited,SET,N/A,Thailand
ALUCON-R.BK,ALUCON Public Company Limited,SET,N/A,Thailand
ALUCON.BK,ALUCON Public Company Limited,SET,N/A,Thailand
AMANAH.BK,Amanah Leasing Public Company Limited,SET,N/A,Thailand
AMARIN.BK,Amarin Printing and Publishing Public Company Limited,SET,N/A,Thailand
AMATAV-R.BK,Amata VN Public Company Limited,SET,N/A,Thailand
AMANAH-R.BK,Amanah Leasing Public Company Limited,SET,N/A,Thailand
AMATA.BK,Amata Corporation Public Company Limited,SET,N/A,Thailand
AMATA-R.BK,Amata Corporation Public Company Limited,SET,N/A,Thailand
AMATAV.BK,Amata VN Public Company Limited,SET,N/A,Thailand
AMATAR.BK,Amata Summit Growth Freehold and Leasehold Real Estate Investment Trust,SET,N/A,Thailand
AMC-R.BK,Asia Metal Public Company Limited,SET,N/A,Thailand
AMC.BK,Asia Metal Public Company Limited,SET,N/A,Thailand
AMARIN-R.BK,Amarin Printing and Publishing Public Company Limited,SET,N/A,Thailand
CTARAF.BK,Centara Hotels and Resorts Leasehold Property Fund,SET,N/A,Thailand
CSS.BK,Communication & System Solution Public Company Limited,SET,N/A,Thailand
HPF.BK,Hemaraj Industrial Property and Leasehold Fund,SET,N/A,Thailand
TREIT.BK,Ticon Freehold & Leasehold Real Estate Investment Trust,SET,N/A,Thailand
ANAN.BK,Ananda Development Public Company Limited,SET,N/A,Thailand
TLGF.BK,Tesco Lotus Retail Growth Freehold and Leasehold Property Fund,SET,N/A,Thailand
TNPF.BK,Trinity Freehold and Leasehold Property Fund,SET,N/A,Thailand
CSS-R.BK,Communication & System Solution Public Company Limited,SET,N/A,Thailand
LHPF.BK,Land and Houses Freehold and Leasehold Property Fund,SET,N/A,Thailand
ANAN-R.BK,Ananda Development Public Company Limited,SET,N/A,Thailand
AOT.BK,Airports of Thailand Public Company Limited,SET,N/A,Thailand
AOT-R.BK,Airports of Thailand Public Company Limited,SET,N/A,Thailand
AP.BK,AP (Thailand) Public Company Limited,SET,N/A,Thailand
APCS.BK,Asia Precision Public Company Limited,SET,N/A,Thailand
APURE.BK,Agripure Holdings Public Company Limited,SET,N/A,Thailand
APURE-R.BK,Agripure Holdings Public Company Limited,SET,N/A,Thailand
APX.BK,Apex Development Public Company Limited,SET,N/A,Thailand
AP-R.BK,AP (Thailand) Public Company Limited,SET,N/A,Thailand
APCO.BK,Asian Phytoceuticals Public Company Limited,SET,N/A,Thailand
APX-R.BK,Apex Development Public Company Limited,SET,N/A,Thailand
APCO-R.BK,Asian Phytoceuticals Public Company Limited,SET,N/A,Thailand
APCS-R.BK,Asia Precision Public Company Limited,SET,N/A,Thailand
AQUA.BK,Aqua Corporation Public Company Limited,SET,N/A,Thailand
AQ.BK,AQ Estate Public Company Limited,SET,N/A,Thailand
AQUA-R.BK,Aqua Corporation Public Company Limited,SET,N/A,Thailand
AQ-R.BK,AQ Estate Public Company Limited,SET,N/A,Thailand
ARIP-R.BK,ARIP Public Company Limited,SET,N/A,Thailand
ARROW-R.BK,Arrow Syndicate Public Company Limited,SET,N/A,Thailand
ARROW.BK,Arrow Syndicate Public Company Limited,SET,N/A,Thailand
ARIP.BK,ARIP Public Company Limited,SET,N/A,Thailand
ASP.BK,Asia Plus Group Holdings Public Company Limited,SET,N/A,Thailand
ASIAN.BK,Asian Seafoods Coldstorage Public Company Limited,SET,N/A,Thailand
BLA-R.BK,Bangkok Life Assurance Public Company Limited,SET,N/A,Thailand
ASCON.BK,ASCON.BK,SET,N/A,Thailand
ASP-R.BK,Asia Plus Group Holdings Public Company Limited,SET,N/A,Thailand
ASEFA-R.BK,Asefa Public Company Limited,SET,N/A,Thailand
PMTA-R.BK,PM Thoresen Asia Holdings Public Company Limited,SET,N/A,Thailand
ASK.BK,Asia Sermkij Leasing Public Company Limited,SET,N/A,Thailand
AS.BK,Asiasoft Corporation Public Company Limited,SET,N/A,Thailand
ASIMAR-R.BK,Asian Marine Services Public Company Limited,SET,N/A,Thailand
UPA.BK,United Power of Asia Public Company Limited,SET,N/A,Thailand
ASEFA.BK,Asefa Public Company Limited,SET,N/A,Thailand
BLA.BK,Bangkok Life Assurance Public Company Limited,SET,N/A,Thailand
ASK-R.BK,Asia Sermkij Leasing Public Company Limited,SET,N/A,Thailand
AS-R.BK,Asiasoft Corporation Public Company Limited,SET,N/A,Thailand
ASIA-R.BK,Asia Hotel Public Company Limited,SET,N/A,Thailand
ASIA.BK,Asia Hotel Public Company Limited,SET,N/A,Thailand
PMTA.BK,PM Thoresen Asia Holdings Public Company Limited,SET,N/A,Thailand
ASIMAR.BK,Asian Marine Services Public Company Limited,SET,N/A,Thailand
PCA.BK,Planet Communications Asia Public Company Limited,SET,N/A,Thailand
PCA-R.BK,Planet Communications Asia Public Company Limited,SET,N/A,Thailand
ASIAN-R.BK,Asian Seafoods Coldstorage Public Company Limited,SET,N/A,Thailand
J.BK,JAS Asset Public Company Limited,SET,N/A,Thailand
SCBLIF.BK,SCB Life Assurance Public Company Limited,SET,N/A,Thailand
J-R.BK,JAS Asset Public Company Limited,SET,N/A,Thailand
ATP30-R.BK,ATP 30 Public Company Limited,SET,N/A,Thailand
ATP30.BK,ATP 30 Public Company Limited,SET,N/A,Thailand
AUCT.BK,Union Auction Public Company Limited,SET,N/A,Thailand
AUCT-R.BK,Union Auction Public Company Limited,SET,N/A,Thailand
AYUD.BK,Sri Ayudhya Capital Public Company Limited,SET,N/A,Thailand
AYUD-R.BK,Sri Ayudhya Capital Public Company Limited,SET,N/A,Thailand
BAY.BK,Bank of Ayudhya Public Company Limited,SET,N/A,Thailand
BRC.BK,BANGKOK RUBBER PUBLIC COMPANY L,SET,N/A,Thailand
BBL.BK,Bangkok Bank Public Company Limited,SET,N/A,Thailand
BBL-R.BK,Bangkok Bank Public Company Limited,SET,N/A,Thailand
BCP.BK,Bangchak Corporation Public Company Limited,SET,N/A,Thailand
BCH-R.BK,Bangkok Chain Hospital Public Company Limited,SET,N/A,Thailand
BCH.BK,Bangkok Chain Hospital Public Company Limited,SET,N/A,Thailand
BCP-R.BK,Bangchak Corporation Public Company Limited,SET,N/A,Thailand
BDMS.BK,Bangkok Dusit Medical Services Public Company Limited,SET,N/A,Thailand
BDMS-R.BK,Bangkok Dusit Medical Services Public Company Limited,SET,N/A,Thailand
BECL.BK,Bangkok Expressway Public Company Limited,SET,N/A,Thailand
BEM.BK,Bangkok Expressway and Metro Public Company Limited,SET,N/A,Thailand
BEAUTY-R.BK,Beauty Community Public Company Limited,SET,N/A,Thailand
BEC-R.BK,BEC World Public Company Limited,SET,N/A,Thailand
BFIT.BK,Srisawad Finance Public Company Limited,SET,N/A,Thailand
BFIT-R.BK,Srisawad Finance Public Company Limited,SET,N/A,Thailand
BGT.BK,BGT Corporation Public Company Limited,SET,N/A,Thailand
BGT-R.BK,BGT Corporation Public Company Limited,SET,N/A,Thailand
BH-R.BK,Bumrungrad Hospital Public Company Limited,SET,N/A,Thailand
BH.BK,Bumrungrad Hospital Public Company Limited,SET,N/A,Thailand
BIGC.BK,Big C Supercenter Public Company Limited,SET,N/A,Thailand
BIG-R.BK,SunWood Industries Public Company Limited,SET,N/A,Thailand
BIG.BK,Big Camera Corporation Public Company Limited,SET,N/A,Thailand
BIGC-R.BK,Big C Supercenter Public Company Limited,SET,N/A,Thailand
BJC.BK,Berli Jucker Public Company Limited,SET,N/A,Thailand
BJC-R.BK,Berli Jucker Public Company Limited,SET,N/A,Thailand
BJCHI.BK,BJC Heavy Industries Public Company Limited,SET,N/A,Thailand
BJCHI-R.BK,BJC Heavy Industries Public Company Limited,SET,N/A,Thailand
BKI-R.BK,Bangkok Insurance Public Company Limited,SET,N/A,Thailand
BKD.BK,Bangkok Dec - Con Public Company Limited,SET,N/A,Thailand
BKI.BK,Bangkok Insurance Public Company Limited,SET,N/A,Thailand
BKD-R.BK,Bangkok Dec - Con Public Company Limited,SET,N/A,Thailand
BKKCP.BK,Bangkok Commercial Property Fund,SET,N/A,Thailand
BLAND-R.BK,Bangkok Land Public Company Limited,SET,N/A,Thailand
BLISS.BK,BLISS-TEL PUBLIC COMPANY LIMITE,SET,N/A,Thailand
BLAND.BK,Bangkok Land Public Company Limited,SET,N/A,Thailand
BLISS-R.BK,BLISS-TEL PUBLIC COMPANY LIMITE,SET,N/A,Thailand
BMCL.BK,Bangkok Metro Public Company Limited,SET,N/A,Thailand
BOL-R.BK,Business Online Public Company Limited,SET,N/A,Thailand
BOL.BK,Business Online Public Company Limited,SET,N/A,Thailand
BROCK-R.BK,Baan Rock Garden Public Company Limited,SET,N/A,Thailand
BROOK.BK,The Brooker Group Public Company Limited,SET,N/A,Thailand
BRR-R.BK,Buriram Sugar Public Company Limited,SET,N/A,Thailand
BROCK.BK,Baan Rock Garden Public Company Limited,SET,N/A,Thailand
BSM-R.BK,BuilderSmart Public Company Limited,SET,N/A,Thailand
BSBM.BK,Bangsaphan Barmill Public Company Limited,SET,N/A,Thailand
BSM.BK,BuilderSmart Public Company Limited,SET,N/A,Thailand
BSBM-R.BK,Bangsaphan Barmill Public Company Limited,SET,N/A,Thailand
BTS.BK,BTS Group Holdings Public Company Limited,SET,N/A,Thailand
BTC.BK,Bangpakong Terminal Public Company Limited,SET,N/A,Thailand
BTC-R.BK,Bangpakong Terminal Public Company Limited,SET,N/A,Thailand
BTS-R.BK,BTS Group Holdings Public Company Limited,SET,N/A,Thailand
BTNC-R.BK,Boutique Newcity Public Company Limited,SET,N/A,Thailand
BTNC.BK,Boutique Newcity Public Company Limited,SET,N/A,Thailand
BTSGIF.BK,BTS Rail Mass Transit Growth Infrastructure Fund,SET,N/A,Thailand
CMR.BK,Chiang Mai Ram Medical Business Public Company Limited,SET,N/A,Thailand
SBPF.BK,Samui buri Property Fund,SET,N/A,Thailand
CMR-R.BK,Chiang Mai Ram Medical Business Public Company Limited,SET,N/A,Thailand
BRR.BK,Buriram Sugar Public Company Limited,SET,N/A,Thailand
BUI.BK,Bangkok Union Insurance Public Company Limited,SET,N/A,Thailand
BUI-R.BK,Bangkok Union Insurance Public Company Limited,SET,N/A,Thailand
BWG.BK,Better World Green Public Company Limited,SET,N/A,Thailand
BWG-R.BK,Better World Green Public Company Limited,SET,N/A,Thailand
GCAP.BK,G Capital Public Company Limited,SET,N/A,Thailand
IFS-R.BK,IFS Capital (Thailand) Public Company Limited,SET,N/A,Thailand
CBG-R.BK,Carabao Group Public Company Limited,SET,N/A,Thailand
CBG.BK,Carabao Group Public Company Limited,SET,N/A,Thailand
CCET-R.BK,Cal-Comp Electronics (Thailand) Public Company Limited,SET,N/A,Thailand
CCN-R.BK,Sky ICT Public Company Limited,SET,N/A,Thailand
CCN.BK,Sky ICT Public Company Limited,SET,N/A,Thailand
CCP-R.BK,Chonburi Concrete Product Public Company Limited,SET,N/A,Thailand
CCP.BK,Chonburi Concrete Product Public Company Limited,SET,N/A,Thailand
CCET.BK,Cal-Comp Electronics (Thailand) Public Company Limited,SET,N/A,Thailand
CEN-R.BK,Capital Engineering Network Public Company Limited,SET,N/A,Thailand
CENTEL.BK,Central Plaza Hotel Public Company Limited,SET,N/A,Thailand
LHSC.BK,LH Shopping Centers Leasehold Real Estate Investment Trust,SET,N/A,Thailand
CEI.BK,Advanced Connection Corporation Public Company Limited,SET,N/A,Thailand
CEI-R.BK,Advanced Connection Corporation Public Company Limited,SET,N/A,Thailand
CPICO.BK,CPICO.BK,SET,N/A,Thailand
TUCC-R.BK,THAI UNIQUE COIL CENTER PUBLIC,SET,N/A,Thailand
TUCC.BK,THAI UNIQUE COIL CENTER PUBLIC,SET,N/A,Thailand
CEN.BK,Capital Engineering Network Public Company Limited,SET,N/A,Thailand
CENTEL-R.BK,Central Plaza Hotel Public Company Limited,SET,N/A,Thailand
CFRESH-R.BK,Seafresh Industry Public Company Limited,SET,N/A,Thailand
CFRESH.BK,Seafresh Industry Public Company Limited,SET,N/A,Thailand
CGD.BK,Country Group Development Public Company Limited,SET,N/A,Thailand
CGD-R.BK,Country Group Development Public Company Limited,SET,N/A,Thailand
CGH.BK,Country Group Holdings Public Company Limited,SET,N/A,Thailand
CGH-R.BK,Country Group Holdings Public Company Limited,SET,N/A,Thailand
CHG.BK,Chularat Hospital Public Company Limited,SET,N/A,Thailand
CHG-R.BK,Chularat Hospital Public Company Limited,SET,N/A,Thailand
CHUO.BK,Chuo Senko (Thailand) Public Company Limited,SET,N/A,Thailand
CHUO-R.BK,Chuo Senko (Thailand) Public Company Limited,SET,N/A,Thailand
CHOW.BK,Chow Steel Industries Public Company Limited,SET,N/A,Thailand
CIMBT.BK,CIMB Thai Bank Public Company Limited,SET,N/A,Thailand
U-R.BK,U City Public Company Limited,SET,N/A,Thailand
MJLF.BK,Major Cineplex Lifestyle Leasehold Property Fund.,SET,N/A,Thailand
CIG.BK,C.I. Group Public Company Limited,SET,N/A,Thailand
CIG-R.BK,C.I. Group Public Company Limited,SET,N/A,Thailand
CIMBT-R.BK,CIMB Thai Bank Public Company Limited,SET,N/A,Thailand
CITY-R.BK,City Steel Public Company Limited,SET,N/A,Thailand
CI-R.BK,Charn Issara Development Public Company Limited,SET,N/A,Thailand
CI.BK,Charn Issara Development Public Company Limited,SET,N/A,Thailand
CITY.BK,City Steel Public Company Limited,SET,N/A,Thailand
CKP.BK,CK Power Public Company Limited,SET,N/A,Thailand
CK.BK,CH. Karnchang Public Company Limited,SET,N/A,Thailand
CK-R.BK,CH. Karnchang Public Company Limited,SET,N/A,Thailand
CKP-R.BK,CK Power Public Company Limited,SET,N/A,Thailand
CMO.BK,CMO Public Company Limited,SET,N/A,Thailand
CM-R.BK,Chiangmai Frozen Foods Public Company Limited,SET,N/A,Thailand
CM.BK,Chiangmai Frozen Foods Public Company Limited,SET,N/A,Thailand
CMO-R.BK,CMO Public Company Limited,SET,N/A,Thailand
CNT.BK,Christiani & Nielsen (Thai) Public Company Limited,SET,N/A,Thailand
CNT-R.BK,Christiani & Nielsen (Thai) Public Company Limited,SET,N/A,Thailand
CNS.BK,Capital Nomura Securities Public Company Limited,SET,N/A,Thailand
CPALL-R.BK,CP ALL Public Company Limited,SET,N/A,Thailand
CPL-R.BK,CPL Group Public Company Limited,SET,N/A,Thailand
CPH.BK,Castle Peak Holdings Public Company Limited,SET,N/A,Thailand
CPI.BK,Chumporn Palm Oil Industry Public Company Limited,SET,N/A,Thailand
CPR-R.BK,CPR Gomu Industrial Public Company Limited,SET,N/A,Thailand
CPN.BK,Central Pattana Public Company Limited,SET,N/A,Thailand
CPALL.BK,CP ALL Public Company Limited,SET,N/A,Thailand
CPF-R.BK,Charoen Pokphand Foods Public Company Limited,SET,N/A,Thailand
CPN-R.BK,Central Pattana Public Company Limited,SET,N/A,Thailand
CPL.BK,CPL Group Public Company Limited,SET,N/A,Thailand
CPH-R.BK,Castle Peak Holdings Public Company Limited,SET,N/A,Thailand
CRYSTAL.BK,Crystal Retail Growth Leasehold Property Fund,SET,N/A,Thailand
CPI-R.BK,Chumporn Palm Oil Industry Public Company Limited,SET,N/A,Thailand
CPF.BK,Charoen Pokphand Foods Public Company Limited,SET,N/A,Thailand
CPR.BK,CPR Gomu Industrial Public Company Limited,SET,N/A,Thailand
CPNCG.BK,CPN Commercial Growth Leasehold Property Fund,SET,N/A,Thailand
CPNRF.BK,CPN Retail Growth Leasehold Property Fund,SET,N/A,Thailand
CPTGF.BK,C.P. Tower Growth Leasehold Property Fund,SET,N/A,Thailand
CRANE.BK,Chukai Public Company Limited,SET,N/A,Thailand
CRANE-R.BK,Chukai Public Company Limited,SET,N/A,Thailand
CSP-R.BK,CSP Steel Center Public Company Limited,SET,N/A,Thailand
CSR.BK,City Sports and Recreation Public Company Limited,SET,N/A,Thailand
CSP.BK,CSP Steel Center Public Company Limited,SET,N/A,Thailand
CSL-R.BK,CS Loxinfo Public Company Limited,SET,N/A,Thailand
CSR-R.BK,City Sports and Recreation Public Company Limited,SET,N/A,Thailand
CSL.BK,CS Loxinfo Public Company Limited,SET,N/A,Thailand
CSC-R.BK,Crown Seal Public Company Limited,SET,N/A,Thailand
CSC.BK,Crown Seal Public Company Limited,SET,N/A,Thailand
CTW-R.BK,Charoong Thai Wire and Cable Public Company Limited,SET,N/A,Thailand
CTW.BK,Charoong Thai Wire and Cable Public Company Limited,SET,N/A,Thailand
CWT-R.BK,Chai Watana Tannery Group Public Company Limited,SET,N/A,Thailand
CWT.BK,Chai Watana Tannery Group Public Company Limited,SET,N/A,Thailand
DAII-R.BK,Daii Group Public Company Limited,SET,N/A,Thailand
DAII.BK,Daii Group Public Company Limited,SET,N/A,Thailand
DCON.BK,DCON Products Public Company Limited,SET,N/A,Thailand
DCC-R.BK,Dynasty Ceramic Public Company Limited,SET,N/A,Thailand
DCC.BK,Dynasty Ceramic Public Company Limited,SET,N/A,Thailand
DCORP-R.BK,Demeter Corporation Public Company Limited,SET,N/A,Thailand
DCORP.BK,Demeter Corporation Public Company Limited,SET,N/A,Thailand
DCON-R.BK,DCON Products Public Company Limited,SET,N/A,Thailand
DELTA.BK,Delta Electronics (Thailand) Public Company Limited,SET,N/A,Thailand
PHOL.BK,Phol Dhanya Public Company Limited,SET,N/A,Thailand
SANKO.BK,Sanko Diecasting (Thailand) Public Company Limited,SET,N/A,Thailand
DIMET.BK,Dimet (siam) Public Company Limited,SET,N/A,Thailand
DIMET-R.BK,Dimet (siam) Public Company Limited,SET,N/A,Thailand
TVD-R.BK,TV Direct Public Company Limited,SET,N/A,Thailand
DIF.BK,Digital Telecommunications Infrastructure Fund,SET,N/A,Thailand
SANKO-R.BK,Sanko Diecasting (Thailand) Public Company Limited,SET,N/A,Thailand
TVD.BK,TV Direct Public Company Limited,SET,N/A,Thailand
DNA-R.BK,DNA 2002 Public Company Limited,SET,N/A,Thailand
DNA.BK,DNA 2002 Public Company Limited,SET,N/A,Thailand
CHO-R.BK,Cho Thavee Public Company Limited,SET,N/A,Thailand
CHO.BK,Cho Thavee Public Company Limited,SET,N/A,Thailand
DRACO.BK,Draco PCB Public Company Limited,SET,N/A,Thailand
DRT.BK,Diamond Building Products Public Company Limited,SET,N/A,Thailand
DRT-R.BK,Diamond Building Products Public Company Limited,SET,N/A,Thailand
DRACO-R.BK,Draco PCB Public Company Limited,SET,N/A,Thailand
DSGT.BK,DSG International (Thailand) Public Company Limited,SET,N/A,Thailand
DSGT-R.BK,DSG International (Thailand) Public Company Limited,SET,N/A,Thailand
DTAC.BK,Total Access Communication Public Company Limited,SET,N/A,Thailand
DTCI-R.BK,D.T.C. Industries Public Company Limited,SET,N/A,Thailand
DTC.BK,Dusit Thani Public Company Limited,SET,N/A,Thailand
DTAC-R.BK,Total Access Communication Public Company Limited,SET,N/A,Thailand
DTCPF.BK,The Dusit Thani Freehold and Leasehold Property Fund,SET,N/A,Thailand
DTC-R.BK,Dusit Thani Public Company Limited,SET,N/A,Thailand
DTCI.BK,D.T.C. Industries Public Company Limited,SET,N/A,Thailand
EASTW.BK,Eastern Water Resources Development and Management Public Company Limited,SET,N/A,Thailand
EASON.BK,Eason Paint Public Company Limited,SET,N/A,Thailand
EPG-R.BK,Eastern Polymer Group Public Company Limited,SET,N/A,Thailand
ECF.BK,East Coast Furnitech Company Limited,SET,N/A,Thailand
EPG.BK,Eastern Polymer Group Public Company Limited,SET,N/A,Thailand
EARTH-R.BK,Energy Earth Public Company Limited,SET,N/A,Thailand
EASON-R.BK,Eason Paint Public Company Limited,SET,N/A,Thailand
EARTH.BK,Energy Earth Public Company Limited,SET,N/A,Thailand
EASTW-R.BK,Eastern Water Resources Development and Management Public Company Limited,SET,N/A,Thailand
ECF-R.BK,East Coast Furnitech Company Limited,SET,N/A,Thailand
ECL-R.BK,Eastern Commercial Leasing Public Company Limited,SET,N/A,Thailand
ECL.BK,Eastern Commercial Leasing Public Company Limited,SET,N/A,Thailand
NINE-R.BK,Nation International Edutainment Public Company Limited,SET,N/A,Thailand
NINE.BK,Nation International Edutainment Public Company Limited,SET,N/A,Thailand
